{
  "format_version": 1,
  "pack_id": "chatgpt-default",
  "description": "Baseline selectors and semantic fallbacks for fake-chatgpt plus live-like ChatGPT surfaces.",
  "updated_at": "2026-04-12T00:00:00Z",
  "capabilities": {
    "composer_ready": [
      {
        "strategy_id": "data-slot-composer",
        "kind": "css",
        "selector": "[data-slot='composer']",
        "score": 1.0
      },
      {
        "strategy_id": "chatgpt-prompt-textarea",
        "kind": "css",
        "selector": "#prompt-textarea",
        "score": 0.99
      },
      {
        "strategy_id": "chatgpt-composer-root",
        "kind": "css",
        "selector": "[data-testid='composer-root'] textarea",
        "score": 0.97
      },
      {
        "strategy_id": "aria-textbox",
        "kind": "aria_role",
        "selector": "[aria-label='Prompt composer']",
        "score": 0.94
      },
      {
        "strategy_id": "submit-neighborhood",
        "kind": "dom_neighborhood",
        "selector": "[data-action='submit']",
        "score": 0.76
      }
    ],
    "submit_available": [
      {
        "strategy_id": "data-action-submit",
        "kind": "css",
        "selector": "[data-action='submit']",
        "score": 1.0
      },
      {
        "strategy_id": "chatgpt-send-button",
        "kind": "css",
        "selector": "[data-testid='send-button']",
        "score": 0.97
      },
      {
        "strategy_id": "button-send",
        "kind": "text",
        "selector": "Send",
        "score": 0.92
      },
      {
        "strategy_id": "composer-neighborhood",
        "kind": "dom_neighborhood",
        "selector": "[data-slot='composer']",
        "score": 0.8
      }
    ],
    "model_picker_visible": [
      {
        "strategy_id": "data-slot-model-picker",
        "kind": "css",
        "selector": "[data-slot='model-picker']",
        "score": 1.0
      },
      {
        "strategy_id": "chatgpt-model-controls",
        "kind": "text",
        "selector": "GPT-5.4 Thinking",
        "score": 0.96
      },
      {
        "strategy_id": "aria-model-trigger",
        "kind": "dom_neighborhood",
        "selector": ".toolbar button:first-child",
        "score": 0.9
      }
    ],
    "thinking_effort_visible": [
      {
        "strategy_id": "data-slot-effort-toggle",
        "kind": "css",
        "selector": "[data-slot='effort-toggle']",
        "score": 1.0
      },
      {
        "strategy_id": "chatgpt-effort-toggle",
        "kind": "text",
        "selector": "Standard reasoning",
        "score": 0.93
      },
      {
        "strategy_id": "aria-effort-toggle",
        "kind": "text",
        "selector": "Standard",
        "score": 0.88
      }
    ],
    "search_mode_visible": [
      {
        "strategy_id": "data-mode-search",
        "kind": "css",
        "selector": "[data-mode='search']",
        "score": 1.0
      },
      {
        "strategy_id": "chatgpt-search-toggle",
        "kind": "text",
        "selector": "Search",
        "score": 0.92
      },
      {
        "strategy_id": "aria-search-toggle",
        "kind": "text",
        "selector": "Search",
        "score": 0.88
      }
    ],
    "research_mode_visible": [
      {
        "strategy_id": "data-mode-research",
        "kind": "css",
        "selector": "[data-mode='research']",
        "score": 1.0
      },
      {
        "strategy_id": "chatgpt-research-toggle",
        "kind": "text",
        "selector": "Deep research",
        "score": 0.92
      },
      {
        "strategy_id": "aria-research-toggle",
        "kind": "text",
        "selector": "Research",
        "score": 0.88
      }
    ],
    "upload_control_visible": [
      {
        "strategy_id": "data-slot-upload-entry",
        "kind": "css",
        "selector": "[data-slot='upload-entry']",
        "score": 1.0
      },
      {
        "strategy_id": "chatgpt-upload-entry",
        "kind": "text",
        "selector": "Add photos and files",
        "score": 0.94
      },
      {
        "strategy_id": "native-file-input",
        "kind": "css",
        "selector": "input[type='file']",
        "score": 0.88
      }
    ],
    "downloadable_artifacts_observable": [
      {
        "strategy_id": "data-slot-artifact-link",
        "kind": "css",
        "selector": "[data-slot='artifact-link']",
        "score": 1.0
      },
      {
        "strategy_id": "chatgpt-download-link",
        "kind": "text",
        "selector": "Download report",
        "score": 0.94
      },
      {
        "strategy_id": "download-link",
        "kind": "css",
        "selector": "a[download]",
        "score": 0.9
      },
      {
        "strategy_id": "aria-download-link",
        "kind": "text",
        "selector": "Download",
        "score": 0.72
      }
    ]
  }
}
